{
  "exampleOnly": true,
  "note": "Non-installable, abbreviated per-file example. Generate every actual file entry from the release directories; null evidence must be measured or hashed.",
  "identity": "poptart-model-pack",
  "version": "0.1.0",
  "minimumApplicationVersion": "0.1.0",
  "maximumApplicationVersion": "0.1.0",
  "cleanupTokenCeiling": null,
  "artifacts": [
    {
      "role": "recognition",
      "url": "https://downloads.playgroundlabs.com/poptart/UNRELEASED/recognition/unified/Preprocessor.mlmodelc/coremldata.bin",
      "relativePath": "recognition/unified/Preprocessor.mlmodelc/coremldata.bin",
      "byteSize": null,
      "sha256": null,
      "license": {
        "name": "CC-BY-4.0",
        "url": "https://creativecommons.org/licenses/by/4.0/"
      }
    },
    {
      "role": "cleanup",
      "url": "https://downloads.playgroundlabs.com/poptart/UNRELEASED/cleanup/config.json",
      "relativePath": "cleanup/config.json",
      "byteSize": null,
      "sha256": null,
      "license": {
        "name": "Apache-2.0",
        "url": "https://www.apache.org/licenses/LICENSE-2.0"
      }
    }
  ]
}
